{
  "oati_version": "1.0",
  "id": "oati:mandate:example:read-1",
  "issuer": "oati:issuer:example:enterprise",
  "subject": "oati:agent:example:buyer",
  "purpose": "inventory_check",
  "actions": ["inventory.read"],
  "resources": ["oati:service:example:inventory"],
  "not_before": "2026-07-27T12:00:00Z",
  "expires_at": "2026-07-27T13:00:00Z",
  "status": "active"
}
